DialogueID,TriggerEvent,SpeakerType,Text_CN,Text_EN,AudioPath,Duration,NextDialogueID,ChoiceOptions
DLG_C2_001,EnterHall2,Narrator,这是第二展厅...左边是温室，右边是镜子。植物在等待生长，镜中的人偶在等待自由。这里...有安吉的记忆。,This is the second hall... On the left is the greenhouse on the right is the mirror. Plants await growth puppets in the mirror await freedom. Here... are memories of Anji.,/Game/Audio/Dialogue/C2/DLG_C2_001.wav,8,,
DLG_C2_002,ObserveSeedBox,Narrator,四种种子，四种颜色。金色、蓝色、紫色、粉红色。它们在等待被种下。,Four seeds four colors. Gold blue purple pink. They await planting.,/Game/Audio/Dialogue/C2/DLG_C2_002.wav,5,,
DLG_C2_003,ReadDiary,Narrator,"2024年8月，安吉百草园。那天，你说想去云上草原，我想留在百草园。我们分开了一段时间。我在植物中漫步，你在草原上奔跑。那一刻，我有点孤独。但当我们在出口重逢时，我们有那么多话想说，那么多故事想分享。我终于明白：有时候，分离是为了更好的生长。就像植物，需要自己的空间，才能扎根更深。","August 2024 Anji Herb Garden. That day you wanted to go to Cloud Grassland I wanted to stay in the Herb Garden. We separated for a while. I wandered among plants you ran on the grassland. At that moment I felt a bit lonely. But when we reunited at the exit we had so much to say so many stories to share. I finally understood: sometimes separation is for better growth. Like plants they need their own space to root deeper.",/Game/Audio/Dialogue/C2/DLG_C2_003.wav,25,,
DLG_C2_004,SunflowerBloomed,Narrator,向日葵追随阳光...就像我追随你的温暖。你的笑容，是我的阳光。,The sunflower follows the sun... just as I follow your warmth. Your smile is my sunlight.,/Game/Audio/Dialogue/C2/DLG_C2_004.wav,6,,
DLG_C2_005,WaterLilyBloomed,Narrator,睡莲生长在水中...就像我们的爱，浸润在日常里。每一天的陪伴，都是滋养。,The water lily grows in water... just as our love is immersed in daily life. Every day of companionship is nourishment.,/Game/Audio/Dialogue/C2/DLG_C2_005.wav,6,,
DLG_C2_006,MoonflowerBloomed,Narrator,月见草在夜晚开花...有些美好，需要等待。我愿意等待，因为我知道你值得。,The moonflower blooms at night... some beauty needs waiting. I am willing to wait because I know you are worth it.,/Game/Audio/Dialogue/C2/DLG_C2_006.wav,6,,
DLG_C2_007,RoseHint,Narrator,蔷薇似乎需要特殊的条件...也许，日记里有线索？,The rose seems to need special conditions... perhaps there are clues in the diary?,/Game/Audio/Dialogue/C2/DLG_C2_007.wav,4,,
DLG_C2_008,RoseRealization,Narrator,分离...空间...也许，蔷薇需要我离开？就像那天在安吉，我们分开了一段路。,Separation... space... perhaps the rose needs me to leave? Just like that day in Anji when we walked separate paths.,/Game/Audio/Dialogue/C2/DLG_C2_008.wav,6,,
DLG_C2_009,RoseBloomed,Narrator,蔷薇需要独处才能生长...那天在安吉，我们分开走了一段路。我有点害怕，但当我们重逢时——我发现，分离让我们更珍惜彼此。独立，是为了更好的相依。,The rose needs solitude to grow... That day in Anji we walked separate paths. I was a bit afraid but when we reunited— I discovered that separation made us cherish each other more. Independence is for better interdependence.,/Game/Audio/Dialogue/C2/DLG_C2_009.wav,12,,
DLG_C2_010,FourFlowersBloomed,Narrator,四种元素，缺一不可。阳光、水分、时间、空间——这就是爱的养分。,Four elements all indispensable. Sunlight water time space— these are the nutrients of love.,/Game/Audio/Dialogue/C2/DLG_C2_010.wav,5,,
DLG_C2_011,EnterMirrorArea,Narrator,这是...《双人成形》？我们一起玩过这个游戏。两个小人，必须合作才能前进。但有时，他们必须分开。,This is... It Takes Two? We played this game together. Two little characters must cooperate to progress. But sometimes they must separate.,/Game/Audio/Dialogue/C2/DLG_C2_011.wav,8,,
DLG_C2_012,ReadStele,Narrator,我们是镜像，但不是复制。我向左，你向右。我上升，你下降。但我们的目标，始终相同。合作，不是失去自我，而是在保持自我的同时，共同前进。,We are mirrors but not copies. I go left you go right. I ascend you descend. But our goal is always the same. Cooperation is not losing oneself but moving forward together while maintaining oneself.,/Game/Audio/Dialogue/C2/DLG_C2_012.wav,12,,
DLG_C2_013,SyncButtonComplete,Narrator,同步...我们的心跳，同步。即使在镜子的两侧，我们依然连接。,Synchronization... our heartbeats synchronize. Even on opposite sides of the mirror we remain connected.,/Game/Audio/Dialogue/C2/DLG_C2_013.wav,5,,
DLG_C2_014,SeparatePathComplete,Narrator,分离...但不是分开。我们走不同的路，但目标相同。就像那天在安吉，你去草原，我留在百草园。我们分开，但心在一起。,Separation... but not apart. We walk different paths but share the same goal. Just like that day in Anji you went to the grassland I stayed in the herb garden. We separated but our hearts were together.,/Game/Audio/Dialogue/C2/DLG_C2_014.wav,10,,
DLG_C2_015,PuppetFusion,Narrator,我们不是一个人，而是两个。但我们的心，紧紧相连。独立，但不孤独。分离，但不分开。,We are not one person but two. But our hearts are tightly connected. Independent but not lonely. Separated but not apart.,/Game/Audio/Dialogue/C2/DLG_C2_015.wav,7,,
DLG_C2_016,RedFlowerObtained,Narrator,第一朵花...红色，代表你。但还缺少另一朵。,The first flower... red representing you. But another is still missing.,/Game/Audio/Dialogue/C2/DLG_C2_016.wav,4,,
DLG_C2_017,ButterflyAppears,Narrator,蝴蝶...时间的使者。它连接着每一个重要的瞬间。,The butterfly... messenger of time. It connects every important moment.,/Game/Audio/Dialogue/C2/DLG_C2_017.wav,4,,
DLG_C2_018,ButterflyVisit1,Narrator,第一次见面...,The first meeting...,/Game/Audio/Dialogue/C2/DLG_C2_018.wav,2,,
DLG_C2_019,ButterflyVisit2,Narrator,珠宝的光芒...,The brilliance of jewels...,/Game/Audio/Dialogue/C2/DLG_C2_019.wav,2,,
DLG_C2_020,ButterflyVisit3,Narrator,永生的秘密...,The secret of immortality...,/Game/Audio/Dialogue/C2/DLG_C2_020.wav,2,,
DLG_C2_021,ButterflyVisit4,Narrator,安吉的分离...,The separation in Anji...,/Game/Audio/Dialogue/C2/DLG_C2_021.wav,2,,
DLG_C2_022,TimeWebFormed,Narrator,从相识，到珠宝展，到埃及展，再到安吉。每一个瞬间，都是我们的故事。时间流逝，但这些记忆，永远连接着我们。,From meeting to the jewelry exhibition to the Egyptian exhibition to Anji. Every moment is our story. Time passes but these memories forever connect us.,/Game/Audio/Dialogue/C2/DLG_C2_022.wav,10,,
DLG_C2_023,SymbolFusion,Narrator,第二个符号...现在的花朵。两朵花，独立但交织。红色是你，蓝色是我。我们不是一体，而是两个独立的生命。但我们的根，紧紧缠绕。这就是我们，此刻的我们。,The second symbol... the flower of the present. Two flowers independent but intertwined. Red is you blue is me. We are not one but two independent lives. But our roots are tightly entwined. This is us us at this moment.,/Game/Audio/Dialogue/C2/DLG_C2_023.wav,12,,
DLG_C2_024,ChapterEnd,Narrator,关系像植物，需要培育。阳光、水分、时间、空间——但最重要的是，耐心和理解。我们在成长，一起，也各自。,Relationships are like plants they need nurturing. Sunlight water time space— but most importantly patience and understanding. We are growing together and separately.,/Game/Audio/Dialogue/C2/DLG_C2_024.wav,10,,

SFX_C2_001,PlantSeed,SoundEffect,种植音效,Planting sound,/Game/Audio/SFX/C2/Plant_Seed.wav,0.5,,
SFX_C2_002,SkylightOpen,SoundEffect,天窗打开音效,Skylight opening sound,/Game/Audio/SFX/C2/Skylight_Open.wav,1,,
SFX_C2_003,Watering,SoundEffect,浇水音效,Watering sound,/Game/Audio/SFX/C2/Watering.wav,1.5,,
SFX_C2_004,ClockTick,SoundEffect,时钟滴答音效,Clock ticking sound,/Game/Audio/SFX/C2/Clock_Tick.wav,循环,,
SFX_C2_005,PlantGrow,SoundEffect,植物生长音效,Plant growing sound,/Game/Audio/SFX/C2/Plant_Grow.wav,3,,
SFX_C2_006,FlowerBloom,SoundEffect,花朵绽放音效,Flower blooming sound,/Game/Audio/SFX/C2/Flower_Bloom.wav,1,,
SFX_C2_007,ButtonPress,SoundEffect,按钮按下音效,Button press sound,/Game/Audio/SFX/C2/Button_Press.wav,0.5,,
SFX_C2_008,MirrorCrack,SoundEffect,镜子破裂音效,Mirror cracking sound,/Game/Audio/SFX/C2/Mirror_Crack.wav,2,,
SFX_C2_009,Fusion,SoundEffect,融合音效,Fusion sound,/Game/Audio/SFX/C2/Fusion.wav,2,,
SFX_C2_010,ButterflyFly,SoundEffect,蝴蝶飞行音效,Butterfly flying sound,/Game/Audio/SFX/C2/Butterfly_Fly.wav,循环,,
SFX_C2_011,SymbolGet,SoundEffect,符号获得音效,Symbol obtained sound,/Game/Audio/SFX/C2/Symbol_Get.wav,3,,
